id,guidislink,link,updated,updated_parsed,published,published_parsed,title,title_detail,summary,summary_detail,authors,author_detail,author,links,arxiv_primary_category,tags,arxiv_comment,arxiv_journal_ref,arxiv_affiliation
http://arxiv.org/abs/2106.11028v1,True,http://arxiv.org/abs/2106.11028v1,2021-06-21T12:23:45Z,"time.struct_time(tm_year=2021, tm_mon=6, tm_mday=21, tm_hour=12, tm_min=23, tm_sec=45, tm_wday=0, tm_yday=172, tm_isdst=0)",2021-06-21T12:23:45Z,"time.struct_time(tm_year=2021, tm_mon=6, tm_mday=21, tm_hour=12, tm_min=23, tm_sec=45, tm_wday=0, tm_yday=172, tm_isdst=0)",Neural Controlled Differential Equations for Online Prediction Tasks,"{'type': 'text/plain', 'language': None, 'base': 'http://export.arxiv.org/api/query?search_query=%22time+series%22&start=12000&max_results=1000&sortBy=submittedDate&sortOrder=ascending', 'value': 'Neural Controlled Differential Equations for Online Prediction Tasks'}","Neural controlled differential equations (Neural CDEs) are a continuous-time
extension of recurrent neural networks (RNNs), achieving state-of-the-art
(SOTA) performance at modelling functions of irregular time series. In order to
interpret discrete data in continuous time, current implementations rely on
non-causal interpolations of the data. This is fine when the whole time series
is observed in advance, but means that Neural CDEs are not suitable for use in
\textit{online prediction tasks}, where predictions need to be made in
real-time: a major use case for recurrent networks. Here, we show how this
limitation may be rectified. First, we identify several theoretical conditions
that interpolation schemes for Neural CDEs should satisfy, such as boundedness
and uniqueness. Second, we use these to motivate the introduction of new
schemes that address these conditions, offering in particular measurability
(for online prediction), and smoothness (for speed). Third, we empirically
benchmark our online Neural CDE model on three continuous monitoring tasks from
the MIMIC-IV medical database: we demonstrate improved performance on all tasks
against ODE benchmarks, and on two of the three tasks against SOTA non-ODE
benchmarks.","{'type': 'text/plain', 'language': None, 'base': 'http://export.arxiv.org/api/query?search_query=%22time+series%22&start=12000&max_results=1000&sortBy=submittedDate&sortOrder=ascending', 'value': 'Neural controlled differential equations (Neural CDEs) are a continuous-time\nextension of recurrent neural networks (RNNs), achieving state-of-the-art\n(SOTA) performance at modelling functions of irregular time series. In order to\ninterpret discrete data in continuous time, current implementations rely on\nnon-causal interpolations of the data. This is fine when the whole time series\nis observed in advance, but means that Neural CDEs are not suitable for use in\n\\textit{online prediction tasks}, where predictions need to be made in\nreal-time: a major use case for recurrent networks. Here, we show how this\nlimitation may be rectified. First, we identify several theoretical conditions\nthat interpolation schemes for Neural CDEs should satisfy, such as boundedness\nand uniqueness. Second, we use these to motivate the introduction of new\nschemes that address these conditions, offering in particular measurability\n(for online prediction), and smoothness (for speed). Third, we empirically\nbenchmark our online Neural CDE model on three continuous monitoring tasks from\nthe MIMIC-IV medical database: we demonstrate improved performance on all tasks\nagainst ODE benchmarks, and on two of the three tasks against SOTA non-ODE\nbenchmarks.'}","[{'name': 'James Morrill'}, {'name': 'Patrick Kidger'}, {'name': 'Lingyi Yang'}, {'name': 'Terry Lyons'}]",{'name': 'Terry Lyons'},Terry Lyons,"[{'href': 'http://arxiv.org/abs/2106.11028v1', 'rel': 'alternate', 'type': 'text/html'}, {'title': 'pdf', 'href': 'http://arxiv.org/pdf/2106.11028v1', 'rel': 'related', 'type': 'application/pdf'}]","{'term': 'cs.LG', 'scheme': 'http://arxiv.org/schemas/atom'}","[{'term': 'cs.LG', 'scheme': 'http://arxiv.org/schemas/atom', 'label': None}]",,,
http://arxiv.org/abs/2106.11043v1,True,http://arxiv.org/abs/2106.11043v1,2021-06-21T12:29:02Z,"time.struct_time(tm_year=2021, tm_mon=6, tm_mday=21, tm_hour=12, tm_min=29, tm_sec=2, tm_wday=0, tm_yday=172, tm_isdst=0)",2021-06-21T12:29:02Z,"time.struct_time(tm_year=2021, tm_mon=6, tm_mday=21, tm_hour=12, tm_min=29, tm_sec=2, tm_wday=0, tm_yday=172, tm_isdst=0)",Scalable Bayesian inference for time series via divide-and-conquer,"{'type': 'text/plain', 'language': None, 'base': 'http://export.arxiv.org/api/query?search_query=%22time+series%22&start=12000&max_results=1000&sortBy=submittedDate&sortOrder=ascending', 'value': 'Scalable Bayesian inference for time series via divide-and-conquer'}","Bayesian computational algorithms tend to scale poorly as data size
increases. This had led to the development of divide-and-conquer-based
approaches for scalable inference. These divide the data into subsets, perform
inference for each subset in parallel, and then combine these inferences. While
appealing theoretical properties and practical performance have been
demonstrated for independent observations, scalable inference for dependent
data remains challenging. In this work, we study the problem of Bayesian
inference from very long time series. The literature in this area focuses
mainly on approximate approaches that lack any theoretical guarantees and may
provide arbitrarily poor accuracy in practice. We propose a simple and scalable
divide-and-conquer method, and provide accuracy guarantees. Numerical
simulations and real data applications demonstrate the effectiveness of our
approach.","{'type': 'text/plain', 'language': None, 'base': 'http://export.arxiv.org/api/query?search_query=%22time+series%22&start=12000&max_results=1000&sortBy=submittedDate&sortOrder=ascending', 'value': 'Bayesian computational algorithms tend to scale poorly as data size\nincreases. This had led to the development of divide-and-conquer-based\napproaches for scalable inference. These divide the data into subsets, perform\ninference for each subset in parallel, and then combine these inferences. While\nappealing theoretical properties and practical performance have been\ndemonstrated for independent observations, scalable inference for dependent\ndata remains challenging. In this work, we study the problem of Bayesian\ninference from very long time series. The literature in this area focuses\nmainly on approximate approaches that lack any theoretical guarantees and may\nprovide arbitrarily poor accuracy in practice. We propose a simple and scalable\ndivide-and-conquer method, and provide accuracy guarantees. Numerical\nsimulations and real data applications demonstrate the effectiveness of our\napproach.'}","[{'name': 'Rihui Ou'}, {'name': 'Deborshee Sen'}, {'name': 'David Dunson'}]",{'name': 'David Dunson'},David Dunson,"[{'href': 'http://arxiv.org/abs/2106.11043v1', 'rel': 'alternate', 'type': 'text/html'}, {'title': 'pdf', 'href': 'http://arxiv.org/pdf/2106.11043v1', 'rel': 'related', 'type': 'application/pdf'}]","{'term': 'stat.ME', 'scheme': 'http://arxiv.org/schemas/atom'}","[{'term': 'stat.ME', 'scheme': 'http://arxiv.org/schemas/atom', 'label': None}, {'term': 'stat.CO', 'scheme': 'http://arxiv.org/schemas/atom', 'label': None}]",,,
http://arxiv.org/abs/2106.11277v1,True,http://arxiv.org/abs/2106.11277v1,2021-06-21T17:27:11Z,"time.struct_time(tm_year=2021, tm_mon=6, tm_mday=21, tm_hour=17, tm_min=27, tm_sec=11, tm_wday=0, tm_yday=172, tm_isdst=0)",2021-06-21T17:27:11Z,"time.struct_time(tm_year=2021, tm_mon=6, tm_mday=21, tm_hour=17, tm_min=27, tm_sec=11, tm_wday=0, tm_yday=172, tm_isdst=0)","Attention-based Neural Network for Driving Environment Complexity
  Perception","{'type': 'text/plain', 'language': None, 'base': 'http://export.arxiv.org/api/query?search_query=%22time+series%22&start=12000&max_results=1000&sortBy=submittedDate&sortOrder=ascending', 'value': 'Attention-based Neural Network for Driving Environment Complexity\n  Perception'}","Environment perception is crucial for autonomous vehicle (AV) safety. Most
existing AV perception algorithms have not studied the surrounding environment
complexity and failed to include the environment complexity parameter. This
paper proposes a novel attention-based neural network model to predict the
complexity level of the surrounding driving environment. The proposed model
takes naturalistic driving videos and corresponding vehicle dynamics parameters
as input. It consists of a Yolo-v3 object detection algorithm, a heat map
generation algorithm, CNN-based feature extractors, and attention-based feature
extractors for both video and time-series vehicle dynamics data inputs to
extract features. The output from the proposed algorithm is a surrounding
environment complexity parameter. The Berkeley DeepDrive dataset (BDD Dataset)
and subjectively labeled surrounding environment complexity levels are used for
model training and validation to evaluate the algorithm. The proposed
attention-based network achieves 91.22% average classification accuracy to
classify the surrounding environment complexity. It proves that the environment
complexity level can be accurately predicted and applied for future AVs'
environment perception studies.","{'type': 'text/plain', 'language': None, 'base': 'http://export.arxiv.org/api/query?search_query=%22time+series%22&start=12000&max_results=1000&sortBy=submittedDate&sortOrder=ascending', 'value': ""Environment perception is crucial for autonomous vehicle (AV) safety. Most\nexisting AV perception algorithms have not studied the surrounding environment\ncomplexity and failed to include the environment complexity parameter. This\npaper proposes a novel attention-based neural network model to predict the\ncomplexity level of the surrounding driving environment. The proposed model\ntakes naturalistic driving videos and corresponding vehicle dynamics parameters\nas input. It consists of a Yolo-v3 object detection algorithm, a heat map\ngeneration algorithm, CNN-based feature extractors, and attention-based feature\nextractors for both video and time-series vehicle dynamics data inputs to\nextract features. The output from the proposed algorithm is a surrounding\nenvironment complexity parameter. The Berkeley DeepDrive dataset (BDD Dataset)\nand subjectively labeled surrounding environment complexity levels are used for\nmodel training and validation to evaluate the algorithm. The proposed\nattention-based network achieves 91.22% average classification accuracy to\nclassify the surrounding environment complexity. It proves that the environment\ncomplexity level can be accurately predicted and applied for future AVs'\nenvironment perception studies.""}","[{'name': 'Ce Zhang'}, {'name': 'Azim Eskandarian'}, {'name': 'Xuelai Du'}]",{'name': 'Xuelai Du'},Xuelai Du,"[{'href': 'http://arxiv.org/abs/2106.11277v1', 'rel': 'alternate', 'type': 'text/html'}, {'title': 'pdf', 'href': 'http://arxiv.org/pdf/2106.11277v1', 'rel': 'related', 'type': 'application/pdf'}]","{'term': 'cs.LG', 'scheme': 'http://arxiv.org/schemas/atom'}","[{'term': 'cs.LG', 'scheme': 'http://arxiv.org/schemas/atom', 'label': None}, {'term': 'cs.CV', 'scheme': 'http://arxiv.org/schemas/atom', 'label': None}, {'term': 'cs.RO', 'scheme': 'http://arxiv.org/schemas/atom', 'label': None}, {'term': 'eess.IV', 'scheme': 'http://arxiv.org/schemas/atom', 'label': None}]",Accepted by 2021 IEEE Intelligent Transportation Systems Conference,,
http://arxiv.org/abs/2106.11518v1,True,http://arxiv.org/abs/2106.11518v1,2021-06-22T03:19:14Z,"time.struct_time(tm_year=2021, tm_mon=6, tm_mday=22, tm_hour=3, tm_min=19, tm_sec=14, tm_wday=1, tm_yday=173, tm_isdst=0)",2021-06-22T03:19:14Z,"time.struct_time(tm_year=2021, tm_mon=6, tm_mday=22, tm_hour=3, tm_min=19, tm_sec=14, tm_wday=1, tm_yday=173, tm_isdst=0)",AGB interlopers in YSO catalogues hunted out by NEOWISE,"{'type': 'text/plain', 'language': None, 'base': 'http://export.arxiv.org/api/query?search_query=%22time+series%22&start=12000&max_results=1000&sortBy=submittedDate&sortOrder=ascending', 'value': 'AGB interlopers in YSO catalogues hunted out by NEOWISE'}","AGBs and YSOs often share the same domains in IR color-magnitude or
color-color diagrams leading to potential mis-classification. We extracted a
list of AGB interlopers from the published YSO catalogues using the periodogram
analysis on NEOWISE time series data. YSO IR variability is typically
stochastic and linked to episodic mass accretion. Furthermore, most variable
YSOs are at an early evolutionary stage, with significant surrounding envelope
and/or disk material. In contrast, AGBs are often identified by a well defined
sinusoidal variability with periods of a few hundreds days. From our
periodogram analysis of all known low mass YSOs in the Gould Belt, we find 85
AGB candidates, out of which 62 were previously classified as late-stage Class
III YSOs. Most of these new AGB candidates have similar IR colors to O-rich
AGBs. We observed 73 of these AGB candidates in the H2O, CH3OH and SiO maser
lines to further reveal their nature. The SiO maser emission was detected in 10
sources, confirming them as AGBs since low mass YSOs, especially Class III
YSOs, do not show such maser emission. The H2O and CH3OH maser lines were
detected in none of our targets.","{'type': 'text/plain', 'language': None, 'base': 'http://export.arxiv.org/api/query?search_query=%22time+series%22&start=12000&max_results=1000&sortBy=submittedDate&sortOrder=ascending', 'value': 'AGBs and YSOs often share the same domains in IR color-magnitude or\ncolor-color diagrams leading to potential mis-classification. We extracted a\nlist of AGB interlopers from the published YSO catalogues using the periodogram\nanalysis on NEOWISE time series data. YSO IR variability is typically\nstochastic and linked to episodic mass accretion. Furthermore, most variable\nYSOs are at an early evolutionary stage, with significant surrounding envelope\nand/or disk material. In contrast, AGBs are often identified by a well defined\nsinusoidal variability with periods of a few hundreds days. From our\nperiodogram analysis of all known low mass YSOs in the Gould Belt, we find 85\nAGB candidates, out of which 62 were previously classified as late-stage Class\nIII YSOs. Most of these new AGB candidates have similar IR colors to O-rich\nAGBs. We observed 73 of these AGB candidates in the H2O, CH3OH and SiO maser\nlines to further reveal their nature. The SiO maser emission was detected in 10\nsources, confirming them as AGBs since low mass YSOs, especially Class III\nYSOs, do not show such maser emission. The H2O and CH3OH maser lines were\ndetected in none of our targets.'}","[{'name': 'Jeong-Eun Lee'}, {'name': 'Sieun Lee'}, {'name': 'Seonjae Lee'}, {'name': 'Kyung-Won Suh'}, {'name': 'Se-Hyung Cho'}, {'name': 'Do-Young Byun'}, {'name': 'Wooseok Park'}, {'name': 'Gregory Herczeg'}, {'name': 'Carlos Contreras Peña'}, {'name': 'Doug Johnstone'}]",{'name': 'Doug Johnstone'},Doug Johnstone,"[{'href': 'http://arxiv.org/abs/2106.11518v1', 'rel': 'alternate', 'type': 'text/html'}, {'title': 'pdf', 'href': 'http://arxiv.org/pdf/2106.11518v1', 'rel': 'related', 'type': 'application/pdf'}]","{'term': 'astro-ph.SR', 'scheme': 'http://arxiv.org/schemas/atom'}","[{'term': 'astro-ph.SR', 'scheme': 'http://arxiv.org/schemas/atom', 'label': None}]",Accepted for publication in ApJL,,
http://arxiv.org/abs/2106.11635v1,True,http://arxiv.org/abs/2106.11635v1,2021-06-22T09:42:51Z,"time.struct_time(tm_year=2021, tm_mon=6, tm_mday=22, tm_hour=9, tm_min=42, tm_sec=51, tm_wday=1, tm_yday=173, tm_isdst=0)",2021-06-22T09:42:51Z,"time.struct_time(tm_year=2021, tm_mon=6, tm_mday=22, tm_hour=9, tm_min=42, tm_sec=51, tm_wday=1, tm_yday=173, tm_isdst=0)","A two-stage robust optimization approach for oxygen flexible
  distribution under uncertainty in iron and steel plants","{'type': 'text/plain', 'language': None, 'base': 'http://export.arxiv.org/api/query?search_query=%22time+series%22&start=12000&max_results=1000&sortBy=submittedDate&sortOrder=ascending', 'value': 'A two-stage robust optimization approach for oxygen flexible\n  distribution under uncertainty in iron and steel plants'}","Oxygen optimal distribution is one of the most important energy management
problems in the modern iron and steel industry. Normally, the supply of the
energy generation system is determined by the energy demand of manufacturing
processes. However, the balance between supply and demand fluctuates frequently
due to the uncertainty arising in manufacturing processes. In this paper, we
developed an oxygen optimal distribution model considering uncertain demands
and proposed a two-stage robust optimization (TSRO) with a budget-based
uncertainty set that protects the initial distribution decisions with low
conservatism. The main goal of the TSRO model is to make wait-and-see decisions
maximizing production profits and make here-and-now decisions minimizing
operational stability and surplus/shortage penalty. To represent the
uncertainty set of energy demands, we developed a Gaussian process (GP)-based
time series model to forecast the energy demands of continuous processes and a
capacity-constrained scheduling model to generate multi-scenario energy demands
of discrete processes. We carried out extensive computational studies on TSRO
and its components using well-synthetic instances from historical data. The
results of model validation and analysis are promising and demonstrate our
approach is adapted to solve industrial cases under uncertainty.","{'type': 'text/plain', 'language': None, 'base': 'http://export.arxiv.org/api/query?search_query=%22time+series%22&start=12000&max_results=1000&sortBy=submittedDate&sortOrder=ascending', 'value': 'Oxygen optimal distribution is one of the most important energy management\nproblems in the modern iron and steel industry. Normally, the supply of the\nenergy generation system is determined by the energy demand of manufacturing\nprocesses. However, the balance between supply and demand fluctuates frequently\ndue to the uncertainty arising in manufacturing processes. In this paper, we\ndeveloped an oxygen optimal distribution model considering uncertain demands\nand proposed a two-stage robust optimization (TSRO) with a budget-based\nuncertainty set that protects the initial distribution decisions with low\nconservatism. The main goal of the TSRO model is to make wait-and-see decisions\nmaximizing production profits and make here-and-now decisions minimizing\noperational stability and surplus/shortage penalty. To represent the\nuncertainty set of energy demands, we developed a Gaussian process (GP)-based\ntime series model to forecast the energy demands of continuous processes and a\ncapacity-constrained scheduling model to generate multi-scenario energy demands\nof discrete processes. We carried out extensive computational studies on TSRO\nand its components using well-synthetic instances from historical data. The\nresults of model validation and analysis are promising and demonstrate our\napproach is adapted to solve industrial cases under uncertainty.'}","[{'name': 'Sheng-Long Jiang'}, {'name': 'Gongzhuang Peng'}, {'name': 'I. David L. Bogle'}]",{'name': 'I. David L. Bogle'},I. David L. Bogle,"[{'href': 'http://arxiv.org/abs/2106.11635v1', 'rel': 'alternate', 'type': 'text/html'}, {'title': 'pdf', 'href': 'http://arxiv.org/pdf/2106.11635v1', 'rel': 'related', 'type': 'application/pdf'}]","{'term': 'math.OC', 'scheme': 'http://arxiv.org/schemas/atom'}","[{'term': 'math.OC', 'scheme': 'http://arxiv.org/schemas/atom', 'label': None}]",,,
http://arxiv.org/abs/2106.11911v1,True,http://arxiv.org/abs/2106.11911v1,2021-06-22T16:38:48Z,"time.struct_time(tm_year=2021, tm_mon=6, tm_mday=22, tm_hour=16, tm_min=38, tm_sec=48, tm_wday=1, tm_yday=173, tm_isdst=0)",2021-06-22T16:38:48Z,"time.struct_time(tm_year=2021, tm_mon=6, tm_mday=22, tm_hour=16, tm_min=38, tm_sec=48, tm_wday=1, tm_yday=173, tm_isdst=0)","Residual Networks as Flows of Velocity Fields for Diffeomorphic Time
  Series Alignment","{'type': 'text/plain', 'language': None, 'base': 'http://export.arxiv.org/api/query?search_query=%22time+series%22&start=12000&max_results=1000&sortBy=submittedDate&sortOrder=ascending', 'value': 'Residual Networks as Flows of Velocity Fields for Diffeomorphic Time\n  Series Alignment'}","Non-linear (large) time warping is a challenging source of nuisance in
time-series analysis. In this paper, we propose a novel diffeomorphic temporal
transformer network for both pairwise and joint time-series alignment. Our
ResNet-TW (Deep Residual Network for Time Warping) tackles the alignment
problem by compositing a flow of incremental diffeomorphic mappings. Governed
by the flow equation, our Residual Network (ResNet) builds smooth, fluid and
regular flows of velocity fields and consequently generates smooth and
invertible transformations (i.e. diffeomorphic warping functions). Inspired by
the elegant Large Deformation Diffeomorphic Metric Mapping (LDDMM) framework,
the final transformation is built by the flow of time-dependent vector fields
which are none other than the building blocks of our Residual Network. The
latter is naturally viewed as an Eulerian discretization schema of the flow
equation (an ODE). Once trained, our ResNet-TW aligns unseen data by a single
inexpensive forward pass. As we show in experiments on both univariate (84
datasets from UCR archive) and multivariate time-series (MSR Action-3D,
Florence-3D and MSR Daily Activity), ResNet-TW achieves competitive performance
in joint alignment and classification.","{'type': 'text/plain', 'language': None, 'base': 'http://export.arxiv.org/api/query?search_query=%22time+series%22&start=12000&max_results=1000&sortBy=submittedDate&sortOrder=ascending', 'value': 'Non-linear (large) time warping is a challenging source of nuisance in\ntime-series analysis. In this paper, we propose a novel diffeomorphic temporal\ntransformer network for both pairwise and joint time-series alignment. Our\nResNet-TW (Deep Residual Network for Time Warping) tackles the alignment\nproblem by compositing a flow of incremental diffeomorphic mappings. Governed\nby the flow equation, our Residual Network (ResNet) builds smooth, fluid and\nregular flows of velocity fields and consequently generates smooth and\ninvertible transformations (i.e. diffeomorphic warping functions). Inspired by\nthe elegant Large Deformation Diffeomorphic Metric Mapping (LDDMM) framework,\nthe final transformation is built by the flow of time-dependent vector fields\nwhich are none other than the building blocks of our Residual Network. The\nlatter is naturally viewed as an Eulerian discretization schema of the flow\nequation (an ODE). Once trained, our ResNet-TW aligns unseen data by a single\ninexpensive forward pass. As we show in experiments on both univariate (84\ndatasets from UCR archive) and multivariate time-series (MSR Action-3D,\nFlorence-3D and MSR Daily Activity), ResNet-TW achieves competitive performance\nin joint alignment and classification.'}","[{'name': 'Hao Huang'}, {'name': 'Boulbaba Ben Amor'}, {'name': 'Xichan Lin'}, {'name': 'Fan Zhu'}, {'name': 'Yi Fang'}]",{'name': 'Yi Fang'},Yi Fang,"[{'href': 'http://arxiv.org/abs/2106.11911v1', 'rel': 'alternate', 'type': 'text/html'}, {'title': 'pdf', 'href': 'http://arxiv.org/pdf/2106.11911v1', 'rel': 'related', 'type': 'application/pdf'}]","{'term': 'cs.CV', 'scheme': 'http://arxiv.org/schemas/atom'}","[{'term': 'cs.CV', 'scheme': 'http://arxiv.org/schemas/atom', 'label': None}]",19 pages,,
