id,guidislink,link,updated,updated_parsed,published,published_parsed,title,title_detail,summary,summary_detail,authors,author_detail,author,links,arxiv_primary_category,tags,arxiv_comment,arxiv_journal_ref,arxiv_affiliation
http://arxiv.org/abs/2106.08781v1,True,http://arxiv.org/abs/2106.08781v1,2021-06-16T13:41:15Z,"time.struct_time(tm_year=2021, tm_mon=6, tm_mday=16, tm_hour=13, tm_min=41, tm_sec=15, tm_wday=2, tm_yday=167, tm_isdst=0)",2021-06-16T13:41:15Z,"time.struct_time(tm_year=2021, tm_mon=6, tm_mday=16, tm_hour=13, tm_min=41, tm_sec=15, tm_wday=2, tm_yday=167, tm_isdst=0)","Magnetic helicity and energy budget around large confined and eruptive
  solar flares","{'type': 'text/plain', 'language': None, 'base': 'http://export.arxiv.org/api/query?search_query=%22time+series%22&start=12000&max_results=1000&sortBy=submittedDate&sortOrder=ascending', 'value': 'Magnetic helicity and energy budget around large confined and eruptive\n  solar flares'}","We investigate the coronal magnetic energy and helicity budgets of ten solar
ARs, around the times of large flares. In particular, we are interested in a
possible relation of the derived quantities to the particular type of the
flares that the AR produces, i.e., whether they are associated with a CME or
they are confined. Using an optimization approach, we employ time series of 3D
nonlinear force-free magnetic field models of ten ARs, covering a time span of
several hours around the time of occurrence of large solar flares (GOES class
M1.0 and larger). We subsequently compute the 3D magnetic vector potentials
associated to the model 3D coronal magnetic field using a finite-volume method.
This allows us to correspondingly compute the coronal magnetic energy and
helicity budgets, as well as related (intensive) quantities such as the
relative contribution of free magnetic energy, $E_{\mathrm{F}}/{E}$ (energy
ratio), the fraction of non-potential (current-carrying) helicity,
$|H_{\mathrm{J}}|/|{H_{V}}|$ (helicity ratio), and the normalized
current-carrying helicity, $|H_{\mathrm{J}}|/{\phi^{\prime}}^{2}$. The total
energy and helicity budgets of flare-productive ARs (extensive parameters)
cover a broad range of magnitudes, with no obvious relation to the eruptive
potential of the individual ARs, i.e., whether or not a CME is produced in
association with the flare. The intensive eruptivity proxies,
$E_{\mathrm{F}}/{E}$ and $|H_{\mathrm{J}}|/|{H_{V}}|$, and
$|H_{\mathrm{J}}|/{\phi^{\prime}}^{2}$, however, seem to be distinctly
different for ARs that produced CME-associated large flares compared to those
which produced confined flares. For the majority of ARs in our sample, we are
able to identify characteristic pre-flare magnitudes of the intensive
quantities, clearly associated to subsequent CME-productivity.","{'type': 'text/plain', 'language': None, 'base': 'http://export.arxiv.org/api/query?search_query=%22time+series%22&start=12000&max_results=1000&sortBy=submittedDate&sortOrder=ascending', 'value': 'We investigate the coronal magnetic energy and helicity budgets of ten solar\nARs, around the times of large flares. In particular, we are interested in a\npossible relation of the derived quantities to the particular type of the\nflares that the AR produces, i.e., whether they are associated with a CME or\nthey are confined. Using an optimization approach, we employ time series of 3D\nnonlinear force-free magnetic field models of ten ARs, covering a time span of\nseveral hours around the time of occurrence of large solar flares (GOES class\nM1.0 and larger). We subsequently compute the 3D magnetic vector potentials\nassociated to the model 3D coronal magnetic field using a finite-volume method.\nThis allows us to correspondingly compute the coronal magnetic energy and\nhelicity budgets, as well as related (intensive) quantities such as the\nrelative contribution of free magnetic energy, $E_{\\mathrm{F}}/{E}$ (energy\nratio), the fraction of non-potential (current-carrying) helicity,\n$|H_{\\mathrm{J}}|/|{H_{V}}|$ (helicity ratio), and the normalized\ncurrent-carrying helicity, $|H_{\\mathrm{J}}|/{\\phi^{\\prime}}^{2}$. The total\nenergy and helicity budgets of flare-productive ARs (extensive parameters)\ncover a broad range of magnitudes, with no obvious relation to the eruptive\npotential of the individual ARs, i.e., whether or not a CME is produced in\nassociation with the flare. The intensive eruptivity proxies,\n$E_{\\mathrm{F}}/{E}$ and $|H_{\\mathrm{J}}|/|{H_{V}}|$, and\n$|H_{\\mathrm{J}}|/{\\phi^{\\prime}}^{2}$, however, seem to be distinctly\ndifferent for ARs that produced CME-associated large flares compared to those\nwhich produced confined flares. For the majority of ARs in our sample, we are\nable to identify characteristic pre-flare magnitudes of the intensive\nquantities, clearly associated to subsequent CME-productivity.'}","[{'name': 'Manu Gupta'}, {'name': 'J. K. Thalmann'}, {'name': 'A. M. Veronig'}]",{'name': 'A. M. Veronig'},A. M. Veronig,"[{'href': 'http://arxiv.org/abs/2106.08781v1', 'rel': 'alternate', 'type': 'text/html'}, {'title': 'pdf', 'href': 'http://arxiv.org/pdf/2106.08781v1', 'rel': 'related', 'type': 'application/pdf'}]","{'term': 'astro-ph.SR', 'scheme': 'http://arxiv.org/schemas/atom'}","[{'term': 'astro-ph.SR', 'scheme': 'http://arxiv.org/schemas/atom', 'label': None}]","Accepted for publication in A & A journal, 19 pages, and 11 figures",,
http://arxiv.org/abs/2106.09053v1,True,http://arxiv.org/abs/2106.09053v1,2021-06-16T18:00:17Z,"time.struct_time(tm_year=2021, tm_mon=6, tm_mday=16, tm_hour=18, tm_min=0, tm_sec=17, tm_wday=2, tm_yday=167, tm_isdst=0)",2021-06-16T18:00:17Z,"time.struct_time(tm_year=2021, tm_mon=6, tm_mday=16, tm_hour=18, tm_min=0, tm_sec=17, tm_wday=2, tm_yday=167, tm_isdst=0)",ASASSN-14lp: two possible solutions for the observed UV suppression,"{'type': 'text/plain', 'language': None, 'base': 'http://export.arxiv.org/api/query?search_query=%22time+series%22&start=12000&max_results=1000&sortBy=submittedDate&sortOrder=ascending', 'value': 'ASASSN-14lp: two possible solutions for the observed UV suppression'}","We test the adequacy of ultraviolet (UV) spectra for characterizing the outer
structure of Type Ia supernova (SN) ejecta. For this purpose, we perform
spectroscopic analysis for ASASSN-14lp, a normal SN Ia showing low continuum in
the mid-UV regime. To explain the strong UV suppression, two possible origins
have been investigated by mapping the chemical profiles over a significant part
of their ejecta. We fit the spectral time series with mid-UV coverage obtained
before and around maximum light by HST, supplemented with ground-based optical
observations for the earliest epochs. The synthetic spectra are calculated with
the one dimensional MC radiative-transfer code TARDIS from self-consistent
ejecta models. Among several physical parameters, we constrain the abundance
profiles of nine chemical elements. We find that a distribution of $^{56}$Ni
(and other iron-group elements) that extends toward the highest velocities
reproduces the observed UV flux well. The presence of radioactive material in
the outer layers of the ejecta, if confirmed, implies strong constraints on the
possible explosion scenarios. We investigate the impact of the inferred
$^{56}$Ni distribution on the early light curves with the radiative transfer
code TURTLS, and confront the results with the observed light curves of
ASASSN-14lp. The inferred abundances are not in conflict with the observed
photometry. We also test whether the UV suppression can be reproduced if the
radiation at the photosphere is significantly lower in the UV regime than the
pure Planck function. In this case, solar metallicity might be sufficient
enough at the highest velocities to reproduce the UV suppression.","{'type': 'text/plain', 'language': None, 'base': 'http://export.arxiv.org/api/query?search_query=%22time+series%22&start=12000&max_results=1000&sortBy=submittedDate&sortOrder=ascending', 'value': 'We test the adequacy of ultraviolet (UV) spectra for characterizing the outer\nstructure of Type Ia supernova (SN) ejecta. For this purpose, we perform\nspectroscopic analysis for ASASSN-14lp, a normal SN Ia showing low continuum in\nthe mid-UV regime. To explain the strong UV suppression, two possible origins\nhave been investigated by mapping the chemical profiles over a significant part\nof their ejecta. We fit the spectral time series with mid-UV coverage obtained\nbefore and around maximum light by HST, supplemented with ground-based optical\nobservations for the earliest epochs. The synthetic spectra are calculated with\nthe one dimensional MC radiative-transfer code TARDIS from self-consistent\nejecta models. Among several physical parameters, we constrain the abundance\nprofiles of nine chemical elements. We find that a distribution of $^{56}$Ni\n(and other iron-group elements) that extends toward the highest velocities\nreproduces the observed UV flux well. The presence of radioactive material in\nthe outer layers of the ejecta, if confirmed, implies strong constraints on the\npossible explosion scenarios. We investigate the impact of the inferred\n$^{56}$Ni distribution on the early light curves with the radiative transfer\ncode TURTLS, and confront the results with the observed light curves of\nASASSN-14lp. The inferred abundances are not in conflict with the observed\nphotometry. We also test whether the UV suppression can be reproduced if the\nradiation at the photosphere is significantly lower in the UV regime than the\npure Planck function. In this case, solar metallicity might be sufficient\nenough at the highest velocities to reproduce the UV suppression.'}","[{'name': 'Barnabás Barna'}, {'name': 'Talytha Pereira'}, {'name': 'Stefan Taubenberger'}, {'name': 'Mark Magee'}, {'name': 'Markus Kromer'}, {'name': 'Wolfgang Kerzendorf'}, {'name': 'Christian Vogl'}, {'name': 'Marc E. Williamson'}, {'name': 'Andreas Flörs'}, {'name': 'Ulrich M. Noebauer'}, {'name': 'Ryan J. Foley'}, {'name': 'Michele Sasdelli'}, {'name': 'Wolfgang Hillebrandt'}]",{'name': 'Wolfgang Hillebrandt'},Wolfgang Hillebrandt,"[{'href': 'http://arxiv.org/abs/2106.09053v1', 'rel': 'alternate', 'type': 'text/html'}, {'title': 'pdf', 'href': 'http://arxiv.org/pdf/2106.09053v1', 'rel': 'related', 'type': 'application/pdf'}]","{'term': 'astro-ph.SR', 'scheme': 'http://arxiv.org/schemas/atom'}","[{'term': 'astro-ph.SR', 'scheme': 'http://arxiv.org/schemas/atom', 'label': None}]","18 pages, 16 figures, accepted for publication in MNRAS",,
http://arxiv.org/abs/2106.09296v1,True,http://arxiv.org/abs/2106.09296v1,2021-06-17T07:59:15Z,"time.struct_time(tm_year=2021, tm_mon=6, tm_mday=17, tm_hour=7, tm_min=59, tm_sec=15, tm_wday=3, tm_yday=168, tm_isdst=0)",2021-06-17T07:59:15Z,"time.struct_time(tm_year=2021, tm_mon=6, tm_mday=17, tm_hour=7, tm_min=59, tm_sec=15, tm_wday=3, tm_yday=168, tm_isdst=0)","Voice2Series: Reprogramming Acoustic Models for Time Series
  Classification","{'type': 'text/plain', 'language': None, 'base': 'http://export.arxiv.org/api/query?search_query=%22time+series%22&start=12000&max_results=1000&sortBy=submittedDate&sortOrder=ascending', 'value': 'Voice2Series: Reprogramming Acoustic Models for Time Series\n  Classification'}","Learning to classify time series with limited data is a practical yet
challenging problem. Current methods are primarily based on hand-designed
feature extraction rules or domain-specific data augmentation. Motivated by the
advances in deep speech processing models and the fact that voice data are
univariate temporal signals, in this paper, we propose Voice2Series (V2S), a
novel end-to-end approach that reprograms acoustic models for time series
classification, through input transformation learning and output label mapping.
Leveraging the representation learning power of a large-scale pre-trained
speech processing model, on 30 different time series tasks we show that V2S
either outperforms or is tied with state-of-the-art methods on 20 tasks, and
improves their average accuracy by 1.84%. We further provide a theoretical
justification of V2S by proving its population risk is upper bounded by the
source risk and a Wasserstein distance accounting for feature alignment via
reprogramming. Our results offer new and effective means to time series
classification.","{'type': 'text/plain', 'language': None, 'base': 'http://export.arxiv.org/api/query?search_query=%22time+series%22&start=12000&max_results=1000&sortBy=submittedDate&sortOrder=ascending', 'value': 'Learning to classify time series with limited data is a practical yet\nchallenging problem. Current methods are primarily based on hand-designed\nfeature extraction rules or domain-specific data augmentation. Motivated by the\nadvances in deep speech processing models and the fact that voice data are\nunivariate temporal signals, in this paper, we propose Voice2Series (V2S), a\nnovel end-to-end approach that reprograms acoustic models for time series\nclassification, through input transformation learning and output label mapping.\nLeveraging the representation learning power of a large-scale pre-trained\nspeech processing model, on 30 different time series tasks we show that V2S\neither outperforms or is tied with state-of-the-art methods on 20 tasks, and\nimproves their average accuracy by 1.84%. We further provide a theoretical\njustification of V2S by proving its population risk is upper bounded by the\nsource risk and a Wasserstein distance accounting for feature alignment via\nreprogramming. Our results offer new and effective means to time series\nclassification.'}","[{'name': 'Chao-Han Huck Yang'}, {'name': 'Yun-Yun Tsai'}, {'name': 'Pin-Yu Chen'}]",{'name': 'Pin-Yu Chen'},Pin-Yu Chen,"[{'href': 'http://arxiv.org/abs/2106.09296v1', 'rel': 'alternate', 'type': 'text/html'}, {'title': 'pdf', 'href': 'http://arxiv.org/pdf/2106.09296v1', 'rel': 'related', 'type': 'application/pdf'}]","{'term': 'cs.LG', 'scheme': 'http://arxiv.org/schemas/atom'}","[{'term': 'cs.LG', 'scheme': 'http://arxiv.org/schemas/atom', 'label': None}, {'term': 'cs.AI', 'scheme': 'http://arxiv.org/schemas/atom', 'label': None}, {'term': 'cs.NE', 'scheme': 'http://arxiv.org/schemas/atom', 'label': None}, {'term': 'cs.SD', 'scheme': 'http://arxiv.org/schemas/atom', 'label': None}, {'term': 'eess.AS', 'scheme': 'http://arxiv.org/schemas/atom', 'label': None}]","Accepted to ICML 2021, 16 Pages","Proceedings of the 38th International Conference on Machine
  Learning 2021",
http://arxiv.org/abs/2106.09305v1,True,http://arxiv.org/abs/2106.09305v1,2021-06-17T08:15:04Z,"time.struct_time(tm_year=2021, tm_mon=6, tm_mday=17, tm_hour=8, tm_min=15, tm_sec=4, tm_wday=3, tm_yday=168, tm_isdst=0)",2021-06-17T08:15:04Z,"time.struct_time(tm_year=2021, tm_mon=6, tm_mday=17, tm_hour=8, tm_min=15, tm_sec=4, tm_wday=3, tm_yday=168, tm_isdst=0)","Time Series is a Special Sequence: Forecasting with Sample Convolution
  and Interaction","{'type': 'text/plain', 'language': None, 'base': 'http://export.arxiv.org/api/query?search_query=%22time+series%22&start=12000&max_results=1000&sortBy=submittedDate&sortOrder=ascending', 'value': 'Time Series is a Special Sequence: Forecasting with Sample Convolution\n  and Interaction'}","Time series is a special type of sequence data, a set of observations
collected at even intervals of time and ordered chronologically. Existing deep
learning techniques use generic sequence models (e.g., recurrent neural
network, Transformer model, or temporal convolutional network) for time series
analysis, which ignore some of its unique properties. For example, the
downsampling of time series data often preserves most of the information in the
data, while this is not true for general sequence data such as text sequence
and DNA sequence. Motivated by the above, in this paper, we propose a novel
neural network architecture and apply it for the time series forecasting
problem, wherein we conduct sample convolution and interaction at multiple
resolutions for temporal modeling. The proposed architecture, namelySCINet,
facilitates extracting features with enhanced predictability. Experimental
results show that SCINet achieves significant prediction accuracy improvement
over existing solutions across various real-world time series forecasting
datasets. In particular, it can achieve high fore-casting accuracy for those
temporal-spatial datasets without using sophisticated spatial modeling
techniques. Our codes and data are presented in the supplemental material.","{'type': 'text/plain', 'language': None, 'base': 'http://export.arxiv.org/api/query?search_query=%22time+series%22&start=12000&max_results=1000&sortBy=submittedDate&sortOrder=ascending', 'value': 'Time series is a special type of sequence data, a set of observations\ncollected at even intervals of time and ordered chronologically. Existing deep\nlearning techniques use generic sequence models (e.g., recurrent neural\nnetwork, Transformer model, or temporal convolutional network) for time series\nanalysis, which ignore some of its unique properties. For example, the\ndownsampling of time series data often preserves most of the information in the\ndata, while this is not true for general sequence data such as text sequence\nand DNA sequence. Motivated by the above, in this paper, we propose a novel\nneural network architecture and apply it for the time series forecasting\nproblem, wherein we conduct sample convolution and interaction at multiple\nresolutions for temporal modeling. The proposed architecture, namelySCINet,\nfacilitates extracting features with enhanced predictability. Experimental\nresults show that SCINet achieves significant prediction accuracy improvement\nover existing solutions across various real-world time series forecasting\ndatasets. In particular, it can achieve high fore-casting accuracy for those\ntemporal-spatial datasets without using sophisticated spatial modeling\ntechniques. Our codes and data are presented in the supplemental material.'}","[{'name': 'Minhao Liu'}, {'name': 'Ailing Zeng'}, {'name': 'Qiuxia Lai'}, {'name': 'Qiang Xu'}]",{'name': 'Qiang Xu'},Qiang Xu,"[{'href': 'http://arxiv.org/abs/2106.09305v1', 'rel': 'alternate', 'type': 'text/html'}, {'title': 'pdf', 'href': 'http://arxiv.org/pdf/2106.09305v1', 'rel': 'related', 'type': 'application/pdf'}]","{'term': 'cs.LG', 'scheme': 'http://arxiv.org/schemas/atom'}","[{'term': 'cs.LG', 'scheme': 'http://arxiv.org/schemas/atom', 'label': None}, {'term': 'cs.AI', 'scheme': 'http://arxiv.org/schemas/atom', 'label': None}]",,,
http://arxiv.org/abs/2106.09327v1,True,http://arxiv.org/abs/2106.09327v1,2021-06-17T08:46:53Z,"time.struct_time(tm_year=2021, tm_mon=6, tm_mday=17, tm_hour=8, tm_min=46, tm_sec=53, tm_wday=3, tm_yday=168, tm_isdst=0)",2021-06-17T08:46:53Z,"time.struct_time(tm_year=2021, tm_mon=6, tm_mday=17, tm_hour=8, tm_min=46, tm_sec=53, tm_wday=3, tm_yday=168, tm_isdst=0)",Minimax Estimation of Partially-Observed Vector AutoRegressions,"{'type': 'text/plain', 'language': None, 'base': 'http://export.arxiv.org/api/query?search_query=%22time+series%22&start=12000&max_results=1000&sortBy=submittedDate&sortOrder=ascending', 'value': 'Minimax Estimation of Partially-Observed Vector AutoRegressions'}","To understand the behavior of large dynamical systems like transportation
networks, one must often rely on measurements transmitted by a set of sensors,
for instance individual vehicles. Such measurements are likely to be incomplete
and imprecise, which makes it hard to recover the underlying signal of
interest.Hoping to quantify this phenomenon, we study the properties of a
partially-observed state-space model. In our setting, the latent state $X$
follows a high-dimensional Vector AutoRegressive process $X_t = \theta X_{t-1}
+ \varepsilon_t$. Meanwhile, the observations $Y$ are given by a
noise-corrupted random sample from the state $Y_t = \Pi_t X_t + \eta_t$.
Several random sampling mechanisms are studied, allowing us to investigate the
effect of spatial and temporal correlations in the distribution of the sampling
matrices $\Pi_t$.We first prove a lower bound on the minimax estimation error
for the transition matrix $\theta$. We then describe a sparse estimator based
on the Dantzig selector and upper bound its non-asymptotic error, showing that
it achieves the optimal convergence rate for most of our sampling mechanisms.
Numerical experiments on simulated time series validate our theoretical
findings, while an application to open railway data highlights the relevance of
this model for public transport traffic analysis.","{'type': 'text/plain', 'language': None, 'base': 'http://export.arxiv.org/api/query?search_query=%22time+series%22&start=12000&max_results=1000&sortBy=submittedDate&sortOrder=ascending', 'value': 'To understand the behavior of large dynamical systems like transportation\nnetworks, one must often rely on measurements transmitted by a set of sensors,\nfor instance individual vehicles. Such measurements are likely to be incomplete\nand imprecise, which makes it hard to recover the underlying signal of\ninterest.Hoping to quantify this phenomenon, we study the properties of a\npartially-observed state-space model. In our setting, the latent state $X$\nfollows a high-dimensional Vector AutoRegressive process $X_t = \\theta X_{t-1}\n+ \\varepsilon_t$. Meanwhile, the observations $Y$ are given by a\nnoise-corrupted random sample from the state $Y_t = \\Pi_t X_t + \\eta_t$.\nSeveral random sampling mechanisms are studied, allowing us to investigate the\neffect of spatial and temporal correlations in the distribution of the sampling\nmatrices $\\Pi_t$.We first prove a lower bound on the minimax estimation error\nfor the transition matrix $\\theta$. We then describe a sparse estimator based\non the Dantzig selector and upper bound its non-asymptotic error, showing that\nit achieves the optimal convergence rate for most of our sampling mechanisms.\nNumerical experiments on simulated time series validate our theoretical\nfindings, while an application to open railway data highlights the relevance of\nthis model for public transport traffic analysis.'}","[{'name': 'Guillaume Dalle'}, {'name': 'Yohann de Castro'}]",{'name': 'Yohann de Castro'},Yohann de Castro,"[{'href': 'http://arxiv.org/abs/2106.09327v1', 'rel': 'alternate', 'type': 'text/html'}, {'title': 'pdf', 'href': 'http://arxiv.org/pdf/2106.09327v1', 'rel': 'related', 'type': 'application/pdf'}]","{'term': 'eess.SP', 'scheme': 'http://arxiv.org/schemas/atom'}","[{'term': 'eess.SP', 'scheme': 'http://arxiv.org/schemas/atom', 'label': None}, {'term': 'math.ST', 'scheme': 'http://arxiv.org/schemas/atom', 'label': None}, {'term': 'stat.ME', 'scheme': 'http://arxiv.org/schemas/atom', 'label': None}, {'term': 'stat.ML', 'scheme': 'http://arxiv.org/schemas/atom', 'label': None}, {'term': 'stat.TH', 'scheme': 'http://arxiv.org/schemas/atom', 'label': None}]",,,"ICJ, ECL"
