id,guidislink,link,updated,updated_parsed,published,published_parsed,title,title_detail,summary,summary_detail,authors,author_detail,author,links,arxiv_primary_category,tags,arxiv_comment,arxiv_journal_ref,arxiv_affiliation
http://arxiv.org/abs/2106.12047v1,True,http://arxiv.org/abs/2106.12047v1,2021-06-15T14:06:54Z,"time.struct_time(tm_year=2021, tm_mon=6, tm_mday=15, tm_hour=14, tm_min=6, tm_sec=54, tm_wday=1, tm_yday=166, tm_isdst=0)",2021-06-15T14:06:54Z,"time.struct_time(tm_year=2021, tm_mon=6, tm_mday=15, tm_hour=14, tm_min=6, tm_sec=54, tm_wday=1, tm_yday=166, tm_isdst=0)","Fluctuations of water quality time series in rivers follow
  superstatistics","{'type': 'text/plain', 'language': None, 'base': 'http://export.arxiv.org/api/query?search_query=%22time+series%22&start=12000&max_results=1000&sortBy=submittedDate&sortOrder=ascending', 'value': 'Fluctuations of water quality time series in rivers follow\n  superstatistics'}","Superstatistics is a general method from nonequilibrium statistical physics
which has been applied to a variety of complex systems, ranging from
hydrodynamic turbulence to traffic delays and air pollution dynamics. Here, we
investigate water quality time series (such as dissolved oxygen concentrations
and electrical conductivity) as measured in rivers, and provide evidence that
they exhibit superstatistical behaviour. Our main example are time series as
recorded in the river Chess in South East England. Specifically, we use
seasonal detrending and empirical mode decomposition (EMD) to separate trends
from fluctuations for the measured data. With either detrending method, we
observe heavy-tailed fluctuation distributions, which are well described by a
log-normal superstatistics for dissolved oxygen. Contrarily, we find a double
peaked non-standard superstatistics for the electrical conductivity data, which
we model using two combined $\chi^2$-distributions.","{'type': 'text/plain', 'language': None, 'base': 'http://export.arxiv.org/api/query?search_query=%22time+series%22&start=12000&max_results=1000&sortBy=submittedDate&sortOrder=ascending', 'value': 'Superstatistics is a general method from nonequilibrium statistical physics\nwhich has been applied to a variety of complex systems, ranging from\nhydrodynamic turbulence to traffic delays and air pollution dynamics. Here, we\ninvestigate water quality time series (such as dissolved oxygen concentrations\nand electrical conductivity) as measured in rivers, and provide evidence that\nthey exhibit superstatistical behaviour. Our main example are time series as\nrecorded in the river Chess in South East England. Specifically, we use\nseasonal detrending and empirical mode decomposition (EMD) to separate trends\nfrom fluctuations for the measured data. With either detrending method, we\nobserve heavy-tailed fluctuation distributions, which are well described by a\nlog-normal superstatistics for dissolved oxygen. Contrarily, we find a double\npeaked non-standard superstatistics for the electrical conductivity data, which\nwe model using two combined $\\chi^2$-distributions.'}","[{'name': 'Benjamin Schäfer'}, {'name': 'Catherine M. Heppell'}, {'name': 'Hefin Rhys'}, {'name': 'Christian Beck'}]",{'name': 'Christian Beck'},Christian Beck,"[{'href': 'http://arxiv.org/abs/2106.12047v1', 'rel': 'alternate', 'type': 'text/html'}, {'title': 'pdf', 'href': 'http://arxiv.org/pdf/2106.12047v1', 'rel': 'related', 'type': 'application/pdf'}]","{'term': 'physics.ao-ph', 'scheme': 'http://arxiv.org/schemas/atom'}","[{'term': 'physics.ao-ph', 'scheme': 'http://arxiv.org/schemas/atom', 'label': None}, {'term': 'physics.bio-ph', 'scheme': 'http://arxiv.org/schemas/atom', 'label': None}, {'term': 'physics.data-an', 'scheme': 'http://arxiv.org/schemas/atom', 'label': None}, {'term': 'stat.AP', 'scheme': 'http://arxiv.org/schemas/atom', 'label': None}]",,,
http://arxiv.org/abs/2106.08328v1,True,http://arxiv.org/abs/2106.08328v1,2021-06-15T18:00:00Z,"time.struct_time(tm_year=2021, tm_mon=6, tm_mday=15, tm_hour=18, tm_min=0, tm_sec=0, tm_wday=1, tm_yday=166, tm_isdst=0)",2021-06-15T18:00:00Z,"time.struct_time(tm_year=2021, tm_mon=6, tm_mday=15, tm_hour=18, tm_min=0, tm_sec=0, tm_wday=1, tm_yday=166, tm_isdst=0)","Eclipsing Binaries Found by the EREBOS Project: Gaia DR2
  6097540197980557440 -- A Deeply Eclipsing sdB+dM System","{'type': 'text/plain', 'language': None, 'base': 'http://export.arxiv.org/api/query?search_query=%22time+series%22&start=12000&max_results=1000&sortBy=submittedDate&sortOrder=ascending', 'value': 'Eclipsing Binaries Found by the EREBOS Project: Gaia DR2\n  6097540197980557440 -- A Deeply Eclipsing sdB+dM System'}","We present time-series spectroscopy and photometry of Gaia DR2
6097540197980557440, a new deeply-eclipsing hot subdwarf B (sdB) + M dwarf (dM)
binary. We discovered this object during the course of the Eclipsing Reflection
Effect Binaries from Optical Surveys (EREBOS) project, which aims to find new
eclipsing sdB+dM binaries (HW Vir systems) and increase the small sample of
studied systems. In addition to the primary eclipse, which is in excess of
$\sim$5 magnitudes in the optical, the light curve also shows features typical
for other HW Vir binaries such as a secondary eclipse and strong reflection
effect from the irradiated, cool companion. The orbital period is 0.127037 d
($\sim$3 hr), falling right at the peak of the orbital period distribution of
known HW Vir systems. Analysis of our time-series spectroscopy yields a radial
velocity semi-amplitude of $K_{\rm sdB}=100.0\pm2.0\,{\rm km\,s}^{-1}$, which
is amongst the fastest line-of-sight velocities found to date for an HW Vir
binary. State-of-the-art atmospheric models that account for deviations from
local thermodynamic equilibrium are used to determine the atmospheric
parameters of the sdB. Although we cannot claim a unique light curve modeling
solution, the best-fitting model has an sdB mass of $M_{\rm sdB} =
0.47\pm0.03\,M_{\odot}$ and a companion mass of $M_{\rm dM} =
0.18\pm0.01\,M_{\odot}$. The radius of the companion appears to be inflated
relative to theoretical mass-radius relationships, consistent with other known
HW Vir binaries. Additionally, the M dwarf is one of the most massive found to
date amongst this type of binary.","{'type': 'text/plain', 'language': None, 'base': 'http://export.arxiv.org/api/query?search_query=%22time+series%22&start=12000&max_results=1000&sortBy=submittedDate&sortOrder=ascending', 'value': 'We present time-series spectroscopy and photometry of Gaia DR2\n6097540197980557440, a new deeply-eclipsing hot subdwarf B (sdB) + M dwarf (dM)\nbinary. We discovered this object during the course of the Eclipsing Reflection\nEffect Binaries from Optical Surveys (EREBOS) project, which aims to find new\neclipsing sdB+dM binaries (HW Vir systems) and increase the small sample of\nstudied systems. In addition to the primary eclipse, which is in excess of\n$\\sim$5 magnitudes in the optical, the light curve also shows features typical\nfor other HW Vir binaries such as a secondary eclipse and strong reflection\neffect from the irradiated, cool companion. The orbital period is 0.127037 d\n($\\sim$3 hr), falling right at the peak of the orbital period distribution of\nknown HW Vir systems. Analysis of our time-series spectroscopy yields a radial\nvelocity semi-amplitude of $K_{\\rm sdB}=100.0\\pm2.0\\,{\\rm km\\,s}^{-1}$, which\nis amongst the fastest line-of-sight velocities found to date for an HW Vir\nbinary. State-of-the-art atmospheric models that account for deviations from\nlocal thermodynamic equilibrium are used to determine the atmospheric\nparameters of the sdB. Although we cannot claim a unique light curve modeling\nsolution, the best-fitting model has an sdB mass of $M_{\\rm sdB} =\n0.47\\pm0.03\\,M_{\\odot}$ and a companion mass of $M_{\\rm dM} =\n0.18\\pm0.01\\,M_{\\odot}$. The radius of the companion appears to be inflated\nrelative to theoretical mass-radius relationships, consistent with other known\nHW Vir binaries. Additionally, the M dwarf is one of the most massive found to\ndate amongst this type of binary.'}","[{'name': 'Kyle A. Corcoran'}, {'name': 'Brad N. Barlow'}, {'name': 'Veronika Schaffenroth'}, {'name': 'Uli Heber'}, {'name': 'Stephen Walser'}, {'name': 'Andreas Irgang'}]",{'name': 'Andreas Irgang'},Andreas Irgang,"[{'href': 'http://arxiv.org/abs/2106.08328v1', 'rel': 'alternate', 'type': 'text/html'}, {'title': 'pdf', 'href': 'http://arxiv.org/pdf/2106.08328v1', 'rel': 'related', 'type': 'application/pdf'}]","{'term': 'astro-ph.SR', 'scheme': 'http://arxiv.org/schemas/atom'}","[{'term': 'astro-ph.SR', 'scheme': 'http://arxiv.org/schemas/atom', 'label': None}]","15 pages, 9 figures, accepted for publication by ApJ",,
http://arxiv.org/abs/2106.08361v1,True,http://arxiv.org/abs/2106.08361v1,2021-06-15T18:15:26Z,"time.struct_time(tm_year=2021, tm_mon=6, tm_mday=15, tm_hour=18, tm_min=15, tm_sec=26, tm_wday=1, tm_yday=166, tm_isdst=0)",2021-06-15T18:15:26Z,"time.struct_time(tm_year=2021, tm_mon=6, tm_mday=15, tm_hour=18, tm_min=15, tm_sec=26, tm_wday=1, tm_yday=166, tm_isdst=0)",Adversarial Attacks on Deep Models for Financial Transaction Records,"{'type': 'text/plain', 'language': None, 'base': 'http://export.arxiv.org/api/query?search_query=%22time+series%22&start=12000&max_results=1000&sortBy=submittedDate&sortOrder=ascending', 'value': 'Adversarial Attacks on Deep Models for Financial Transaction Records'}","Machine learning models using transaction records as inputs are popular among
financial institutions. The most efficient models use deep-learning
architectures similar to those in the NLP community, posing a challenge due to
their tremendous number of parameters and limited robustness. In particular,
deep-learning models are vulnerable to adversarial attacks: a little change in
the input harms the model's output.
  In this work, we examine adversarial attacks on transaction records data and
defences from these attacks. The transaction records data have a different
structure than the canonical NLP or time series data, as neighbouring records
are less connected than words in sentences, and each record consists of both
discrete merchant code and continuous transaction amount. We consider a
black-box attack scenario, where the attack doesn't know the true decision
model, and pay special attention to adding transaction tokens to the end of a
sequence. These limitations provide more realistic scenario, previously
unexplored in NLP world.
  The proposed adversarial attacks and the respective defences demonstrate
remarkable performance using relevant datasets from the financial industry. Our
results show that a couple of generated transactions are sufficient to fool a
deep-learning model. Further, we improve model robustness via adversarial
training or separate adversarial examples detection. This work shows that
embedding protection from adversarial attacks improves model robustness,
allowing a wider adoption of deep models for transaction records in banking and
finance.","{'type': 'text/plain', 'language': None, 'base': 'http://export.arxiv.org/api/query?search_query=%22time+series%22&start=12000&max_results=1000&sortBy=submittedDate&sortOrder=ascending', 'value': ""Machine learning models using transaction records as inputs are popular among\nfinancial institutions. The most efficient models use deep-learning\narchitectures similar to those in the NLP community, posing a challenge due to\ntheir tremendous number of parameters and limited robustness. In particular,\ndeep-learning models are vulnerable to adversarial attacks: a little change in\nthe input harms the model's output.\n  In this work, we examine adversarial attacks on transaction records data and\ndefences from these attacks. The transaction records data have a different\nstructure than the canonical NLP or time series data, as neighbouring records\nare less connected than words in sentences, and each record consists of both\ndiscrete merchant code and continuous transaction amount. We consider a\nblack-box attack scenario, where the attack doesn't know the true decision\nmodel, and pay special attention to adding transaction tokens to the end of a\nsequence. These limitations provide more realistic scenario, previously\nunexplored in NLP world.\n  The proposed adversarial attacks and the respective defences demonstrate\nremarkable performance using relevant datasets from the financial industry. Our\nresults show that a couple of generated transactions are sufficient to fool a\ndeep-learning model. Further, we improve model robustness via adversarial\ntraining or separate adversarial examples detection. This work shows that\nembedding protection from adversarial attacks improves model robustness,\nallowing a wider adoption of deep models for transaction records in banking and\nfinance.""}","[{'name': 'Ivan Fursov'}, {'name': 'Matvey Morozov'}, {'name': 'Nina Kaploukhaya'}, {'name': 'Elizaveta Kovtun'}, {'name': 'Rodrigo Rivera-Castro'}, {'name': 'Gleb Gusev'}, {'name': 'Dmitry Babaev'}, {'name': 'Ivan Kireev'}, {'name': 'Alexey Zaytsev'}, {'name': 'Evgeny Burnaev'}]",{'name': 'Evgeny Burnaev'},Evgeny Burnaev,"[{'href': 'http://arxiv.org/abs/2106.08361v1', 'rel': 'alternate', 'type': 'text/html'}, {'title': 'pdf', 'href': 'http://arxiv.org/pdf/2106.08361v1', 'rel': 'related', 'type': 'application/pdf'}]","{'term': 'cs.LG', 'scheme': 'http://arxiv.org/schemas/atom'}","[{'term': 'cs.LG', 'scheme': 'http://arxiv.org/schemas/atom', 'label': None}, {'term': 'cs.CR', 'scheme': 'http://arxiv.org/schemas/atom', 'label': None}, {'term': 'q-fin.ST', 'scheme': 'http://arxiv.org/schemas/atom', 'label': None}]",,,
http://arxiv.org/abs/2106.08411v1,True,http://arxiv.org/abs/2106.08411v1,2021-06-15T20:03:57Z,"time.struct_time(tm_year=2021, tm_mon=6, tm_mday=15, tm_hour=20, tm_min=3, tm_sec=57, tm_wday=1, tm_yday=166, tm_isdst=0)",2021-06-15T20:03:57Z,"time.struct_time(tm_year=2021, tm_mon=6, tm_mday=15, tm_hour=20, tm_min=3, tm_sec=57, tm_wday=1, tm_yday=166, tm_isdst=0)",Linearized Field Deblending: PSF Photometry for Impatient Astronomers,"{'type': 'text/plain', 'language': None, 'base': 'http://export.arxiv.org/api/query?search_query=%22time+series%22&start=12000&max_results=1000&sortBy=submittedDate&sortOrder=ascending', 'value': 'Linearized Field Deblending: PSF Photometry for Impatient Astronomers'}","NASA's Kepler, K2 and TESS missions employ Simple Aperture Photometry (SAP)
to derive time-series photometry, where an aperture is estimated for each star,
and pixels containing each star are summed to create a single light curve. This
method is simple, but in crowded fields the derived time-series can be highly
contaminated. The alternate method of fitting a Point Spread Function (PSF) to
the data is able to account for crowding, but is computationally expensive. In
this paper, we present a new approach to extracting photometry from these
time-series missions, which fits the PSF directly, but makes simplifying
assumptions in order to greatly reduce the computation expense. Our method
fixes the scene of the field in each image, estimates the PSF shape of the
instrument with a linear model, and allows only source flux and position to
vary. We demonstrate that our method is able to separate the photometry from
blended targets in the Kepler dataset that are separated by less than a pixel.
Our method is fast to compute, and fully accounts for uncertainties from
degeneracies due to crowded fields. We name the method described in this work
Linearized Field Deblending (LFD). We demonstrate our method on the false
positive Kepler target \koi. We are able to separate the photometry of the two
sources in the data, and demonstrate the contaminating transiting signal is
consistent with a small, sub-stellar companion with a radius of $2.67R_{jup}$
($0.27R_{sol}$). Our method is equally applicable to extracting photometry from
NASA's TESS mission.","{'type': 'text/plain', 'language': None, 'base': 'http://export.arxiv.org/api/query?search_query=%22time+series%22&start=12000&max_results=1000&sortBy=submittedDate&sortOrder=ascending', 'value': ""NASA's Kepler, K2 and TESS missions employ Simple Aperture Photometry (SAP)\nto derive time-series photometry, where an aperture is estimated for each star,\nand pixels containing each star are summed to create a single light curve. This\nmethod is simple, but in crowded fields the derived time-series can be highly\ncontaminated. The alternate method of fitting a Point Spread Function (PSF) to\nthe data is able to account for crowding, but is computationally expensive. In\nthis paper, we present a new approach to extracting photometry from these\ntime-series missions, which fits the PSF directly, but makes simplifying\nassumptions in order to greatly reduce the computation expense. Our method\nfixes the scene of the field in each image, estimates the PSF shape of the\ninstrument with a linear model, and allows only source flux and position to\nvary. We demonstrate that our method is able to separate the photometry from\nblended targets in the Kepler dataset that are separated by less than a pixel.\nOur method is fast to compute, and fully accounts for uncertainties from\ndegeneracies due to crowded fields. We name the method described in this work\nLinearized Field Deblending (LFD). We demonstrate our method on the false\npositive Kepler target \\koi. We are able to separate the photometry of the two\nsources in the data, and demonstrate the contaminating transiting signal is\nconsistent with a small, sub-stellar companion with a radius of $2.67R_{jup}$\n($0.27R_{sol}$). Our method is equally applicable to extracting photometry from\nNASA's TESS mission.""}","[{'name': 'Christina Hedges'}, {'name': 'Rodrigo Luger'}, {'name': 'Jorge Martinez Palomera'}, {'name': 'Jessie Dotson'}, {'name': 'Geert Barentsen'}]",{'name': 'Geert Barentsen'},Geert Barentsen,"[{'href': 'http://arxiv.org/abs/2106.08411v1', 'rel': 'alternate', 'type': 'text/html'}, {'title': 'pdf', 'href': 'http://arxiv.org/pdf/2106.08411v1', 'rel': 'related', 'type': 'application/pdf'}]","{'term': 'astro-ph.IM', 'scheme': 'http://arxiv.org/schemas/atom'}","[{'term': 'astro-ph.IM', 'scheme': 'http://arxiv.org/schemas/atom', 'label': None}, {'term': 'astro-ph.EP', 'scheme': 'http://arxiv.org/schemas/atom', 'label': None}]","22 Pages, 9 Figures",,
http://arxiv.org/abs/2106.08420v2,True,http://arxiv.org/abs/2106.08420v2,2021-06-22T10:41:07Z,"time.struct_time(tm_year=2021, tm_mon=6, tm_mday=22, tm_hour=10, tm_min=41, tm_sec=7, tm_wday=1, tm_yday=173, tm_isdst=0)",2021-06-15T20:24:32Z,"time.struct_time(tm_year=2021, tm_mon=6, tm_mday=15, tm_hour=20, tm_min=24, tm_sec=32, tm_wday=1, tm_yday=166, tm_isdst=0)",Time Series Momentum Predictability via Dynamic Binary Classification,"{'type': 'text/plain', 'language': None, 'base': 'http://export.arxiv.org/api/query?search_query=%22time+series%22&start=12000&max_results=1000&sortBy=submittedDate&sortOrder=ascending', 'value': 'Time Series Momentum Predictability via Dynamic Binary Classification'}","Time series momentum strategies are widely applied in the quantitative
financial industry and its academic research has grown rapidly since the work
of Moskowitz, Ooi and Pedersen (2012). However, trading signals are usually
obtained via simple observation of past return measurements. In this article we
study the benefits of incorporating dynamic econometric models to sequentially
learn the time-varying importance of different look-back periods for individual
assets. By the use of a dynamic binary classifier model, the investor is able
to switch between time-varying or constant relations between past momentum and
future returns, dynamically combining different look-back periods and improving
trading signals accuracy and portfolio performance. Using data from 56 future
contracts we show that a mean-variance investor will be willing to pay a
considerable managment fee to switch from the traditional naive time series
momentum strategy to the dynamic classifier approach.","{'type': 'text/plain', 'language': None, 'base': 'http://export.arxiv.org/api/query?search_query=%22time+series%22&start=12000&max_results=1000&sortBy=submittedDate&sortOrder=ascending', 'value': 'Time series momentum strategies are widely applied in the quantitative\nfinancial industry and its academic research has grown rapidly since the work\nof Moskowitz, Ooi and Pedersen (2012). However, trading signals are usually\nobtained via simple observation of past return measurements. In this article we\nstudy the benefits of incorporating dynamic econometric models to sequentially\nlearn the time-varying importance of different look-back periods for individual\nassets. By the use of a dynamic binary classifier model, the investor is able\nto switch between time-varying or constant relations between past momentum and\nfuture returns, dynamically combining different look-back periods and improving\ntrading signals accuracy and portfolio performance. Using data from 56 future\ncontracts we show that a mean-variance investor will be willing to pay a\nconsiderable managment fee to switch from the traditional naive time series\nmomentum strategy to the dynamic classifier approach.'}","[{'name': 'Bruno P. C. Levy'}, {'name': 'Hedibert F. Lopes'}]",{'name': 'Hedibert F. Lopes'},Hedibert F. Lopes,"[{'href': 'http://arxiv.org/abs/2106.08420v2', 'rel': 'alternate', 'type': 'text/html'}, {'title': 'pdf', 'href': 'http://arxiv.org/pdf/2106.08420v2', 'rel': 'related', 'type': 'application/pdf'}]","{'term': 'q-fin.ST', 'scheme': 'http://arxiv.org/schemas/atom'}","[{'term': 'q-fin.ST', 'scheme': 'http://arxiv.org/schemas/atom', 'label': None}]",,,
