id,guidislink,link,updated,updated_parsed,published,published_parsed,title,title_detail,summary,summary_detail,authors,author_detail,author,links,arxiv_primary_category,tags,arxiv_comment,arxiv_journal_ref,arxiv_affiliation
http://arxiv.org/abs/2106.10038v1,True,http://arxiv.org/abs/2106.10038v1,2021-06-18T10:20:54Z,"time.struct_time(tm_year=2021, tm_mon=6, tm_mday=18, tm_hour=10, tm_min=20, tm_sec=54, tm_wday=4, tm_yday=169, tm_isdst=0)",2021-06-18T10:20:54Z,"time.struct_time(tm_year=2021, tm_mon=6, tm_mday=18, tm_hour=10, tm_min=20, tm_sec=54, tm_wday=4, tm_yday=169, tm_isdst=0)","Anomalous diffusion in the citation time series of scientific
  publications","{'type': 'text/plain', 'language': None, 'base': 'http://export.arxiv.org/api/query?search_query=%22time+series%22&start=12000&max_results=1000&sortBy=submittedDate&sortOrder=ascending', 'value': 'Anomalous diffusion in the citation time series of scientific\n  publications'}","We analyze the citation time-series of manuscripts in three different fields
of science; physics, social science and technology. The evolution of the
time-series of the yearly number of citations, namely the citation
trajectories, diffuse anomalously, their variance scales with time $\propto
t^{2H}$, where $H\neq 1/2$. We provide detailed analysis of the various factors
that lead to the anomalous behavior: non-stationarity, long-ranged correlations
and a fat-tailed increment distribution. The papers exhibit high degree of
heterogeneity, across the various fields, as the statistics of the highest
cited papers is fundamentally different from that of the lower ones. The
citation data is shown to be highly correlated and non-stationary; as all the
papers except the small percentage of them with high number of citations, die
out in time.","{'type': 'text/plain', 'language': None, 'base': 'http://export.arxiv.org/api/query?search_query=%22time+series%22&start=12000&max_results=1000&sortBy=submittedDate&sortOrder=ascending', 'value': 'We analyze the citation time-series of manuscripts in three different fields\nof science; physics, social science and technology. The evolution of the\ntime-series of the yearly number of citations, namely the citation\ntrajectories, diffuse anomalously, their variance scales with time $\\propto\nt^{2H}$, where $H\\neq 1/2$. We provide detailed analysis of the various factors\nthat lead to the anomalous behavior: non-stationarity, long-ranged correlations\nand a fat-tailed increment distribution. The papers exhibit high degree of\nheterogeneity, across the various fields, as the statistics of the highest\ncited papers is fundamentally different from that of the lower ones. The\ncitation data is shown to be highly correlated and non-stationary; as all the\npapers except the small percentage of them with high number of citations, die\nout in time.'}","[{'name': 'Maryam Zamani'}, {'name': 'Erez Aghion'}, {'name': 'Peter Pollner'}, {'name': 'Tamas Vicsek'}, {'name': 'Holger Kantz'}]",{'name': 'Holger Kantz'},Holger Kantz,"[{'href': 'http://arxiv.org/abs/2106.10038v1', 'rel': 'alternate', 'type': 'text/html'}, {'title': 'pdf', 'href': 'http://arxiv.org/pdf/2106.10038v1', 'rel': 'related', 'type': 'application/pdf'}]","{'term': 'cs.DL', 'scheme': 'http://arxiv.org/schemas/atom'}","[{'term': 'cs.DL', 'scheme': 'http://arxiv.org/schemas/atom', 'label': None}, {'term': 'physics.soc-ph', 'scheme': 'http://arxiv.org/schemas/atom', 'label': None}]","12 pages, 12 figures",,
http://arxiv.org/abs/2106.10052v1,True,http://arxiv.org/abs/2106.10052v1,2021-06-18T11:00:24Z,"time.struct_time(tm_year=2021, tm_mon=6, tm_mday=18, tm_hour=11, tm_min=0, tm_sec=24, tm_wday=4, tm_yday=169, tm_isdst=0)",2021-06-18T11:00:24Z,"time.struct_time(tm_year=2021, tm_mon=6, tm_mday=18, tm_hour=11, tm_min=0, tm_sec=24, tm_wday=4, tm_yday=169, tm_isdst=0)",On Contrastive Representations of Stochastic Processes,"{'type': 'text/plain', 'language': None, 'base': 'http://export.arxiv.org/api/query?search_query=%22time+series%22&start=12000&max_results=1000&sortBy=submittedDate&sortOrder=ascending', 'value': 'On Contrastive Representations of Stochastic Processes'}","Learning representations of stochastic processes is an emerging problem in
machine learning with applications from meta-learning to physical object models
to time series. Typical methods rely on exact reconstruction of observations,
but this approach breaks down as observations become high-dimensional or noise
distributions become complex. To address this, we propose a unifying framework
for learning contrastive representations of stochastic processes (CRESP) that
does away with exact reconstruction. We dissect potential use cases for
stochastic process representations, and propose methods that accommodate each.
Empirically, we show that our methods are effective for learning
representations of periodic functions, 3D objects and dynamical processes. Our
methods tolerate noisy high-dimensional observations better than traditional
approaches, and the learned representations transfer to a range of downstream
tasks.","{'type': 'text/plain', 'language': None, 'base': 'http://export.arxiv.org/api/query?search_query=%22time+series%22&start=12000&max_results=1000&sortBy=submittedDate&sortOrder=ascending', 'value': 'Learning representations of stochastic processes is an emerging problem in\nmachine learning with applications from meta-learning to physical object models\nto time series. Typical methods rely on exact reconstruction of observations,\nbut this approach breaks down as observations become high-dimensional or noise\ndistributions become complex. To address this, we propose a unifying framework\nfor learning contrastive representations of stochastic processes (CRESP) that\ndoes away with exact reconstruction. We dissect potential use cases for\nstochastic process representations, and propose methods that accommodate each.\nEmpirically, we show that our methods are effective for learning\nrepresentations of periodic functions, 3D objects and dynamical processes. Our\nmethods tolerate noisy high-dimensional observations better than traditional\napproaches, and the learned representations transfer to a range of downstream\ntasks.'}","[{'name': 'Emile Mathieu'}, {'name': 'Adam Foster'}, {'name': 'Yee Whye Teh'}]",{'name': 'Yee Whye Teh'},Yee Whye Teh,"[{'href': 'http://arxiv.org/abs/2106.10052v1', 'rel': 'alternate', 'type': 'text/html'}, {'title': 'pdf', 'href': 'http://arxiv.org/pdf/2106.10052v1', 'rel': 'related', 'type': 'application/pdf'}]","{'term': 'stat.ML', 'scheme': 'http://arxiv.org/schemas/atom'}","[{'term': 'stat.ML', 'scheme': 'http://arxiv.org/schemas/atom', 'label': None}, {'term': 'cs.LG', 'scheme': 'http://arxiv.org/schemas/atom', 'label': None}]",,,
http://arxiv.org/abs/2106.10121v1,True,http://arxiv.org/abs/2106.10121v1,2021-06-18T13:22:12Z,"time.struct_time(tm_year=2021, tm_mon=6, tm_mday=18, tm_hour=13, tm_min=22, tm_sec=12, tm_wday=4, tm_yday=169, tm_isdst=0)",2021-06-18T13:22:12Z,"time.struct_time(tm_year=2021, tm_mon=6, tm_mday=18, tm_hour=13, tm_min=22, tm_sec=12, tm_wday=4, tm_yday=169, tm_isdst=0)","ScoreGrad: Multivariate Probabilistic Time Series Forecasting with
  Continuous Energy-based Generative Models","{'type': 'text/plain', 'language': None, 'base': 'http://export.arxiv.org/api/query?search_query=%22time+series%22&start=12000&max_results=1000&sortBy=submittedDate&sortOrder=ascending', 'value': 'ScoreGrad: Multivariate Probabilistic Time Series Forecasting with\n  Continuous Energy-based Generative Models'}","Multivariate time series prediction has attracted a lot of attention because
of its wide applications such as intelligence transportation, AIOps. Generative
models have achieved impressive results in time series modeling because they
can model data distribution and take noise into consideration. However, many
existing works can not be widely used because of the constraints of functional
form of generative models or the sensitivity to hyperparameters. In this paper,
we propose ScoreGrad, a multivariate probabilistic time series forecasting
framework based on continuous energy-based generative models. ScoreGrad is
composed of time series feature extraction module and conditional stochastic
differential equation based score matching module. The prediction can be
achieved by iteratively solving reverse-time SDE. To the best of our knowledge,
ScoreGrad is the first continuous energy based generative model used for time
series forecasting. Furthermore, ScoreGrad achieves state-of-the-art results on
six real-world datasets. The impact of hyperparameters and sampler types on the
performance are also explored. Code is available at
https://github.com/yantijin/ScoreGradPred.","{'type': 'text/plain', 'language': None, 'base': 'http://export.arxiv.org/api/query?search_query=%22time+series%22&start=12000&max_results=1000&sortBy=submittedDate&sortOrder=ascending', 'value': 'Multivariate time series prediction has attracted a lot of attention because\nof its wide applications such as intelligence transportation, AIOps. Generative\nmodels have achieved impressive results in time series modeling because they\ncan model data distribution and take noise into consideration. However, many\nexisting works can not be widely used because of the constraints of functional\nform of generative models or the sensitivity to hyperparameters. In this paper,\nwe propose ScoreGrad, a multivariate probabilistic time series forecasting\nframework based on continuous energy-based generative models. ScoreGrad is\ncomposed of time series feature extraction module and conditional stochastic\ndifferential equation based score matching module. The prediction can be\nachieved by iteratively solving reverse-time SDE. To the best of our knowledge,\nScoreGrad is the first continuous energy based generative model used for time\nseries forecasting. Furthermore, ScoreGrad achieves state-of-the-art results on\nsix real-world datasets. The impact of hyperparameters and sampler types on the\nperformance are also explored. Code is available at\nhttps://github.com/yantijin/ScoreGradPred.'}","[{'name': 'Tijin Yan'}, {'name': 'Hongwei Zhang'}, {'name': 'Tong Zhou'}, {'name': 'Yufeng Zhan'}, {'name': 'Yuanqing Xia'}]",{'name': 'Yuanqing Xia'},Yuanqing Xia,"[{'href': 'http://arxiv.org/abs/2106.10121v1', 'rel': 'alternate', 'type': 'text/html'}, {'title': 'pdf', 'href': 'http://arxiv.org/pdf/2106.10121v1', 'rel': 'related', 'type': 'application/pdf'}]","{'term': 'cs.LG', 'scheme': 'http://arxiv.org/schemas/atom'}","[{'term': 'cs.LG', 'scheme': 'http://arxiv.org/schemas/atom', 'label': None}, {'term': 'stat.ML', 'scheme': 'http://arxiv.org/schemas/atom', 'label': None}]","12 pages, 10 figures",,
http://arxiv.org/abs/2106.10157v1,True,http://arxiv.org/abs/2106.10157v1,2021-06-18T14:50:11Z,"time.struct_time(tm_year=2021, tm_mon=6, tm_mday=18, tm_hour=14, tm_min=50, tm_sec=11, tm_wday=4, tm_yday=169, tm_isdst=0)",2021-06-18T14:50:11Z,"time.struct_time(tm_year=2021, tm_mon=6, tm_mday=18, tm_hour=14, tm_min=50, tm_sec=11, tm_wday=4, tm_yday=169, tm_isdst=0)",pyWATTS: Python Workflow Automation Tool for Time Series,"{'type': 'text/plain', 'language': None, 'base': 'http://export.arxiv.org/api/query?search_query=%22time+series%22&start=12000&max_results=1000&sortBy=submittedDate&sortOrder=ascending', 'value': 'pyWATTS: Python Workflow Automation Tool for Time Series'}","Time series data are fundamental for a variety of applications, ranging from
financial markets to energy systems. Due to their importance, the number and
complexity of tools and methods used for time series analysis is constantly
increasing. However, due to unclear APIs and a lack of documentation,
researchers struggle to integrate them into their research projects and
replicate results. Additionally, in time series analysis there exist many
repetitive tasks, which are often re-implemented for each project,
unnecessarily costing time. To solve these problems we present
\texttt{pyWATTS}, an open-source Python-based package that is a non-sequential
workflow automation tool for the analysis of time series data. pyWATTS includes
modules with clearly defined interfaces to enable seamless integration of new
or existing methods, subpipelining to easily reproduce repetitive tasks, load
and save functionality to simply replicate results, and native support for key
Python machine learning libraries such as scikit-learn, PyTorch, and Keras.","{'type': 'text/plain', 'language': None, 'base': 'http://export.arxiv.org/api/query?search_query=%22time+series%22&start=12000&max_results=1000&sortBy=submittedDate&sortOrder=ascending', 'value': 'Time series data are fundamental for a variety of applications, ranging from\nfinancial markets to energy systems. Due to their importance, the number and\ncomplexity of tools and methods used for time series analysis is constantly\nincreasing. However, due to unclear APIs and a lack of documentation,\nresearchers struggle to integrate them into their research projects and\nreplicate results. Additionally, in time series analysis there exist many\nrepetitive tasks, which are often re-implemented for each project,\nunnecessarily costing time. To solve these problems we present\n\\texttt{pyWATTS}, an open-source Python-based package that is a non-sequential\nworkflow automation tool for the analysis of time series data. pyWATTS includes\nmodules with clearly defined interfaces to enable seamless integration of new\nor existing methods, subpipelining to easily reproduce repetitive tasks, load\nand save functionality to simply replicate results, and native support for key\nPython machine learning libraries such as scikit-learn, PyTorch, and Keras.'}","[{'name': 'Benedikt Heidrich'}, {'name': 'Andreas Bartschat'}, {'name': 'Marian Turowski'}, {'name': 'Oliver Neumann'}, {'name': 'Kaleb Phipps'}, {'name': 'Stefan Meisenbacher'}, {'name': 'Kai Schmieder'}, {'name': 'Nicole Ludwig'}, {'name': 'Ralf Mikut'}, {'name': 'Veit Hagenmeyer'}]",{'name': 'Veit Hagenmeyer'},Veit Hagenmeyer,"[{'href': 'http://arxiv.org/abs/2106.10157v1', 'rel': 'alternate', 'type': 'text/html'}, {'title': 'pdf', 'href': 'http://arxiv.org/pdf/2106.10157v1', 'rel': 'related', 'type': 'application/pdf'}]","{'term': 'cs.LG', 'scheme': 'http://arxiv.org/schemas/atom'}","[{'term': 'cs.LG', 'scheme': 'http://arxiv.org/schemas/atom', 'label': None}]",,,
http://arxiv.org/abs/2106.10159v1,True,http://arxiv.org/abs/2106.10159v1,2021-06-18T14:51:14Z,"time.struct_time(tm_year=2021, tm_mon=6, tm_mday=18, tm_hour=14, tm_min=51, tm_sec=14, tm_wday=4, tm_yday=169, tm_isdst=0)",2021-06-18T14:51:14Z,"time.struct_time(tm_year=2021, tm_mon=6, tm_mday=18, tm_hour=14, tm_min=51, tm_sec=14, tm_wday=4, tm_yday=169, tm_isdst=0)","FinGAT: Financial Graph Attention Networks for Recommending Top-K
  Profitable Stocks","{'type': 'text/plain', 'language': None, 'base': 'http://export.arxiv.org/api/query?search_query=%22time+series%22&start=12000&max_results=1000&sortBy=submittedDate&sortOrder=ascending', 'value': 'FinGAT: Financial Graph Attention Networks for Recommending Top-K\n  Profitable Stocks'}","Financial technology (FinTech) has drawn much attention among investors and
companies. While conventional stock analysis in FinTech targets at predicting
stock prices, less effort is made for profitable stock recommendation. Besides,
in existing approaches on modeling time series of stock prices, the
relationships among stocks and sectors (i.e., categories of stocks) are either
neglected or pre-defined. Ignoring stock relationships will miss the
information shared between stocks while using pre-defined relationships cannot
depict the latent interactions or influence of stock prices between stocks. In
this work, we aim at recommending the top-K profitable stocks in terms of
return ratio using time series of stock prices and sector information. We
propose a novel deep learning-based model, Financial Graph Attention Networks
(FinGAT), to tackle the task under the setting that no pre-defined
relationships between stocks are given. The idea of FinGAT is three-fold.
First, we devise a hierarchical learning component to learn short-term and
long-term sequential patterns from stock time series. Second, a fully-connected
graph between stocks and a fully-connected graph between sectors are
constructed, along with graph attention networks, to learn the latent
interactions among stocks and sectors. Third, a multi-task objective is devised
to jointly recommend the profitable stocks and predict the stock movement.
Experiments conducted on Taiwan Stock, S&P 500, and NASDAQ datasets exhibit
remarkable recommendation performance of our FinGAT, comparing to
state-of-the-art methods.","{'type': 'text/plain', 'language': None, 'base': 'http://export.arxiv.org/api/query?search_query=%22time+series%22&start=12000&max_results=1000&sortBy=submittedDate&sortOrder=ascending', 'value': 'Financial technology (FinTech) has drawn much attention among investors and\ncompanies. While conventional stock analysis in FinTech targets at predicting\nstock prices, less effort is made for profitable stock recommendation. Besides,\nin existing approaches on modeling time series of stock prices, the\nrelationships among stocks and sectors (i.e., categories of stocks) are either\nneglected or pre-defined. Ignoring stock relationships will miss the\ninformation shared between stocks while using pre-defined relationships cannot\ndepict the latent interactions or influence of stock prices between stocks. In\nthis work, we aim at recommending the top-K profitable stocks in terms of\nreturn ratio using time series of stock prices and sector information. We\npropose a novel deep learning-based model, Financial Graph Attention Networks\n(FinGAT), to tackle the task under the setting that no pre-defined\nrelationships between stocks are given. The idea of FinGAT is three-fold.\nFirst, we devise a hierarchical learning component to learn short-term and\nlong-term sequential patterns from stock time series. Second, a fully-connected\ngraph between stocks and a fully-connected graph between sectors are\nconstructed, along with graph attention networks, to learn the latent\ninteractions among stocks and sectors. Third, a multi-task objective is devised\nto jointly recommend the profitable stocks and predict the stock movement.\nExperiments conducted on Taiwan Stock, S&P 500, and NASDAQ datasets exhibit\nremarkable recommendation performance of our FinGAT, comparing to\nstate-of-the-art methods.'}","[{'name': 'Yi-Ling Hsu'}, {'name': 'Yu-Che Tsai'}, {'name': 'Cheng-Te Li'}]",{'name': 'Cheng-Te Li'},Cheng-Te Li,"[{'href': 'http://arxiv.org/abs/2106.10159v1', 'rel': 'alternate', 'type': 'text/html'}, {'title': 'pdf', 'href': 'http://arxiv.org/pdf/2106.10159v1', 'rel': 'related', 'type': 'application/pdf'}]","{'term': 'cs.LG', 'scheme': 'http://arxiv.org/schemas/atom'}","[{'term': 'cs.LG', 'scheme': 'http://arxiv.org/schemas/atom', 'label': None}, {'term': 'cs.CE', 'scheme': 'http://arxiv.org/schemas/atom', 'label': None}, {'term': 'cs.IR', 'scheme': 'http://arxiv.org/schemas/atom', 'label': None}, {'term': 'cs.SI', 'scheme': 'http://arxiv.org/schemas/atom', 'label': None}]","Accepted to IEEE TKDE 2021. The first two authors equally contribute
  to this work. Code is available at
  https://github.com/Roytsai27/Financial-GraphAttention",,
http://arxiv.org/abs/2106.10203v1,True,http://arxiv.org/abs/2106.10203v1,2021-06-18T16:13:59Z,"time.struct_time(tm_year=2021, tm_mon=6, tm_mday=18, tm_hour=16, tm_min=13, tm_sec=59, tm_wday=4, tm_yday=169, tm_isdst=0)",2021-06-18T16:13:59Z,"time.struct_time(tm_year=2021, tm_mon=6, tm_mday=18, tm_hour=16, tm_min=13, tm_sec=59, tm_wday=4, tm_yday=169, tm_isdst=0)","Trend estimation and short-term forecasting of COVID-19 cases and deaths
  worldwide","{'type': 'text/plain', 'language': None, 'base': 'http://export.arxiv.org/api/query?search_query=%22time+series%22&start=12000&max_results=1000&sortBy=submittedDate&sortOrder=ascending', 'value': 'Trend estimation and short-term forecasting of COVID-19 cases and deaths\n  worldwide'}","Since the beginning of the COVID-19 pandemic, many dashboards have emerged as
useful tools to monitor the evolution of the pandemic, inform the public, and
assist governments in decision making. Our goal is to develop a globally
applicable method, integrated in a twice daily updated dashboard that provides
an estimate of the trend in the evolution of the number of cases and deaths
from reported data of more than 200 countries and territories, as well as a
seven-day forecast. One of the significant difficulties to manage a quickly
propagating epidemic is that the details of the dynamic needed to forecast its
evolution are obscured by the delays in the identification of cases and deaths
and by irregular reporting. Our forecasting methodology substantially relies on
estimating the underlying trend in the observed time series using robust
seasonal trend decomposition techniques. This allows us to obtain forecasts
with simple, yet effective extrapolation methods in linear or log scale. We
present the results of an assessment of our forecasting methodology and discuss
its application to the production of global and regional risk maps.","{'type': 'text/plain', 'language': None, 'base': 'http://export.arxiv.org/api/query?search_query=%22time+series%22&start=12000&max_results=1000&sortBy=submittedDate&sortOrder=ascending', 'value': 'Since the beginning of the COVID-19 pandemic, many dashboards have emerged as\nuseful tools to monitor the evolution of the pandemic, inform the public, and\nassist governments in decision making. Our goal is to develop a globally\napplicable method, integrated in a twice daily updated dashboard that provides\nan estimate of the trend in the evolution of the number of cases and deaths\nfrom reported data of more than 200 countries and territories, as well as a\nseven-day forecast. One of the significant difficulties to manage a quickly\npropagating epidemic is that the details of the dynamic needed to forecast its\nevolution are obscured by the delays in the identification of cases and deaths\nand by irregular reporting. Our forecasting methodology substantially relies on\nestimating the underlying trend in the observed time series using robust\nseasonal trend decomposition techniques. This allows us to obtain forecasts\nwith simple, yet effective extrapolation methods in linear or log scale. We\npresent the results of an assessment of our forecasting methodology and discuss\nits application to the production of global and regional risk maps.'}","[{'name': 'Ekaterina Krymova'}, {'name': 'Benjamín Béjar'}, {'name': 'Dorina Thanou'}, {'name': 'Tao Sun'}, {'name': 'Elisa Manetti'}, {'name': 'Gavin Lee'}, {'name': 'Kristen Namigai'}, {'name': 'Christine Choirat'}, {'name': 'Antoine Flahault'}, {'name': 'Guillaume Obozinski'}]",{'name': 'Guillaume Obozinski'},Guillaume Obozinski,"[{'href': 'http://arxiv.org/abs/2106.10203v1', 'rel': 'alternate', 'type': 'text/html'}, {'title': 'pdf', 'href': 'http://arxiv.org/pdf/2106.10203v1', 'rel': 'related', 'type': 'application/pdf'}]","{'term': 'stat.AP', 'scheme': 'http://arxiv.org/schemas/atom'}","[{'term': 'stat.AP', 'scheme': 'http://arxiv.org/schemas/atom', 'label': None}, {'term': '92D30, 00-01, 60G25', 'scheme': 'http://arxiv.org/schemas/atom', 'label': None}]",15 pages including 5 pages of supplementary material,,
